{"restore": "01hzyrestore00000000000001", "instance": {"id": "01hzyinst00000000000000002", "engine": "postgres", "version": "17", "image": "ghcr.io/falak-sh/falak-postgres:17", "digest": "sha256:aaaaaaaaaaaaaaaaaaaaaaaaaaaaaaaaaaaaaaaaaaaaaaaaaaaaaaaaaaaaaaaa", "volume_id": "01hzyvol000000000000000002", "host_port": 20002, "memory_bytes": 536870912, "aliases": ["falak-db-01hzyinst00000000000000002"], "tls": {"certificate": "-----BEGIN CERTIFICATE-----\nMIIB\n-----END CERTIFICATE-----\n", "private_key": "-----BEGIN PRIVATE KEY-----\nMIIE\n-----END PRIVATE KEY-----\n"}}, "password": "s3cret", "base": {"url": "https://backups.r2.example.com/shop/base/20261009T120000Z.tar.zst.fkb?X-Amz-Signature=abc", "sha256": "9f86d081884c7d659a2feaa0c55ad015a3bf4f1b2b0b822cd15d6c15b0f00a08", "plaintext_sha256": "60303ae22b998861bce3b28f33eec1be758a213c86c93c076dbe9f558c11c752", "size_bytes": 1048576, "plaintext_bytes": 4194304, "encryption": {"mode": "cp", "key_id": "01hzybackup000000000000001", "key": "q6urq6urq6urq6urq6urq6urq6urq6urq6urq6urq6s="}}, "segments": [{"name": "000000010000000000000003", "url": "https://backups.r2.example.com/shop/wal/000000010000000000000003.zst.fkb?X-Amz-Signature=abc", "sha256": "9f86d081884c7d659a2feaa0c55ad015a3bf4f1b2b0b822cd15d6c15b0f00a08", "plaintext_sha256": "60303ae22b998861bce3b28f33eec1be758a213c86c93c076dbe9f558c11c752", "size_bytes": 65536, "plaintext_bytes": 16777216, "encryption": {"mode": "cp", "key_id": "01hzyseg000000000000000001", "key": "q6urq6urq6urq6urq6urq6urq6urq6urq6urq6urq6s="}}], "target_time": "2026-10-09T12:30:00Z", "databases": ["shop"], "inspection": {"username": "falak_inspect", "password": "insp-Pa55word-1"}}
